2024-02-20T15:37:13 15:37:12.623879 IP 192.168.17.101 > 151.101.1.140: ICMP echo request, id 40, seq 13, length 64
2024-02-20T15:37:14 15:37:13.647373 IP 192.168.17.101 > 151.101.1.140: ICMP echo request, id 40, seq 14, length 64
2024-02-20T15:37:15 15:37:14.671324 IP 192.168.17.101 > 151.101.1.140: ICMP echo request, id 40, seq 15, length 64
2024-02-20T15:37:16 15:37:15.695342 IP 192.168.17.101 > 151.101.1.140: ICMP echo request, id 40, seq 16, length 64
2024-02-20T15:37:17 15:37:16.719571 IP 192.168.17.101 > 151.101.1.140: ICMP echo request, id 40, seq 17, length 64
2024-02-20T15:37:18 15:37:17.743470 IP 192.168.17.101 > 151.101.1.140: ICMP echo request, id 40, seq 18, length 64
2024-02-20T15:37:19 15:37:18.767384 IP 192.168.17.101 > 151.101.1.140: ICMP echo request, id 40, seq 19, length 64
2024-02-20T15:37:20 15:37:19.791391 IP 192.168.17.101 > 151.101.1.140: ICMP echo request, id 40, seq 20, length 64
2024-02-20T15:37:21 15:37:20.815349 IP 192.168.17.101 > 151.101.1.140: ICMP echo request, id 40, seq 21, length 64
2024-02-20T15:37:22 15:37:21.844480 IP 192.168.17.101 > 151.101.1.140: ICMP echo request, id 40, seq 22, length 64
2024-02-20T15:37:23 15:37:22.863347 IP 192.168.17.101 > 151.101.1.140: ICMP echo request, id 40, seq 23, length 64
2024-02-20T15:37:24 15:37:23.887390 IP 192.168.17.101 > 151.101.1.140: ICMP echo request, id 40, seq 24, length 64
2024-02-20T15:37:25 15:37:24.911407 IP 192.168.17.101 > 151.101.1.140: ICMP echo request, id 40, seq 25, length 64
2024-02-20T15:37:26 15:37:25.935351 IP 192.168.17.101 > 151.101.1.140: ICMP echo request, id 40, seq 26, length 64
2024-02-20T15:37:27 15:37:26.959838 IP 192.168.17.101 > 151.101.1.140: ICMP echo request, id 40, seq 27, length 64
2024-02-20T15:37:28 15:37:27.983354 IP 192.168.17.101 > 151.101.1.140: ICMP echo request, id 40, seq 28, length 64
2024-02-20T15:37:29 15:37:29.007337 IP 192.168.17.101 > 151.101.1.140: ICMP echo request, id 40, seq 29, length 64
2024-02-20T15:37:30 15:37:30.031332 IP 192.168.17.101 > 151.101.1.140: ICMP echo request, id 40, seq 30, length 64
2024-02-20T15:37:31 15:37:31.055400 IP 192.168.17.101 > 151.101.1.140: ICMP echo request, id 40, seq 31, length 64
2024-02-20T15:37:32 15:37:32.079345 IP 192.168.17.101 > 151.101.1.140: ICMP echo request, id 40, seq 32, length 64
2024-02-20T15:37:33 15:37:33.103374 IP 192.168.17.101 > 151.101.1.140: ICMP echo request, id 40, seq 33, length 64
2024-02-20T15:37:34 15:37:34.127349 IP 192.168.17.101 > 151.101.1.140: ICMP echo request, id 40, seq 34, length 64
2024-02-20T15:37:35 15:37:35.151333 IP 192.168.17.101 > 151.101.1.140: ICMP echo request, id 40, seq 35, length 64
2024-02-20T15:37:36 15:37:36.176739 IP 192.168.17.101 > 151.101.1.140: ICMP echo request, id 40, seq 36, length 64
2024-02-20T15:37:37 15:37:37.199392 IP 192.168.17.101 > 151.101.1.140: ICMP echo request, id 40, seq 37, length 64
2024-02-20T15:37:38 15:37:38.223427 IP 192.168.17.101 > 151.101.1.140: ICMP echo request, id 40, seq 38, length 64
2024-02-20T15:37:38 15:37:38.319066 ARP, Request who-has 192.168.17.1 tell 192.168.17.101, length 28
2024-02-20T15:37:38 15:37:38.319119 ARP, Reply 192.168.17.1 is-at d8:3a:dd:7d:e0:b5 (oui Unknown), length 28
2024-02-20T15:37:39 15:37:39.247345 IP 192.168.17.101 > 151.101.1.140: ICMP echo request, id 40, seq 39, length 64
2024-02-20T15:37:40 15:37:40.271349 IP 192.168.17.101 > 151.101.1.140: ICMP echo request, id 40, seq 40, length 64
2024-02-20T15:37:41 15:37:41.295364 IP 192.168.17.101 > 151.101.1.140: ICMP echo request, id 40, seq 41, length 64
2024-02-20T15:37:42 15:37:42.337353 IP 192.168.17.101 > 151.101.1.140: ICMP echo request, id 40, seq 42, length 64
2024-02-20T15:37:43 15:37:43.343361 IP 192.168.17.101 > 151.101.1.140: ICMP echo request, id 40, seq 43, length 64
2024-02-20T15:37:44 15:37:44.367361 IP 192.168.17.101 > 151.101.1.140: ICMP echo request, id 40, seq 44, length 64
2024-02-20T15:37:45 15:37:45.391351 IP 192.168.17.101 > 151.101.1.140: ICMP echo request, id 40, seq 45, length 64
2024-02-20T15:37:46 15:37:46.415351 IP 192.168.17.101 > 151.101.1.140: ICMP echo request, id 40, seq 46, length 64
2024-02-20T15:37:47 15:37:47.440377 IP 192.168.17.101 > 151.101.1.140: ICMP echo request, id 40, seq 47, length 64
2024-02-20T15:37:48 15:37:48.463414 IP 192.168.17.101 > 151.101.1.140: ICMP echo request, id 40, seq 48, length 64
2024-02-20T15:37:49 15:37:49.487340 IP 192.168.17.101 > 151.101.1.140: ICMP echo request, id 40, seq 49, length 64
2024-02-20T15:37:50 15:37:50.511326 IP 192.168.17.101 > 151.101.1.140: ICMP echo request, id 40, seq 50, length 64
2024-02-20T15:37:51 15:37:51.535339 IP 192.168.17.101 > 151.101.1.140: ICMP echo request, id 40, seq 51, length 64
2024-02-20T15:37:53 15:37:52.559332 IP 192.168.17.101 > 151.101.1.140: ICMP echo request, id 40, seq 52, length 64
2024-02-20T15:37:54 15:37:53.583358 IP 192.168.17.101 > 151.101.1.140: ICMP echo request, id 40, seq 53, length 64
2024-02-20T15:37:55 15:37:54.607351 IP 192.168.17.101 > 151.101.1.140: ICMP echo request, id 40, seq 54, length 64
2024-02-20T15:37:56 15:37:55.631348 IP 192.168.17.101 > 151.101.1.140: ICMP echo request, id 40, seq 55, length 64
2024-02-20T15:37:57 15:37:56.666742 IP 192.168.17.101 > 151.101.1.140: ICMP echo request, id 40, seq 56, length 64
2024-02-20T15:37:58 15:37:57.679337 IP 192.168.17.101 > 151.101.1.140: ICMP echo request, id 40, seq 57, length 64
2024-02-20T15:37:59 15:37:58.703361 IP 192.168.17.101 > 151.101.1.140: ICMP echo request, id 40, seq 58, length 64
2024-02-20T15:38:00 15:37:59.727352 IP 192.168.17.101 > 151.101.1.140: ICMP echo request, id 40, seq 59, length 64
2024-02-20T15:38:01 15:38:00.751356 IP 192.168.17.101 > 151.101.1.140: ICMP echo request, id 40, seq 60, length 64
2024-02-20T15:38:02 15:38:01.775376 IP 192.168.17.101 > 151.101.1.140: ICMP echo request, id 40, seq 61, length 64
2024-02-20T15:38:03 15:38:02.799353 IP 192.168.17.101 > 151.101.1.140: ICMP echo request, id 40, seq 62, length 64
2024-02-20T15:38:04 15:38:03.823355 IP 192.168.17.101 > 151.101.1.140: ICMP echo request, id 40, seq 63, length 64
2024-02-20T15:38:05 15:38:04.847345 IP 192.168.17.101 > 151.101.1.140: ICMP echo request, id 40, seq 64, length 64
2024-02-20T15:38:06 15:38:05.871357 IP 192.168.17.101 > 151.101.1.140: ICMP echo request, id 40, seq 65, length 64
2024-02-20T15:38:07 15:38:06.894499 IP 192.168.17.101 > 151.101.1.140: ICMP echo request, id 40, seq 66, length 64
2024-02-20T15:38:08 15:38:07.919865 IP 192.168.17.101 > 151.101.1.140: ICMP echo request, id 40, seq 67, length 64
2024-02-20T15:38:09 15:38:08.943334 IP 192.168.17.101 > 151.101.1.140: ICMP echo request, id 40, seq 68, length 64
2024-02-20T15:38:10 15:38:09.967341 IP 192.168.17.101 > 151.101.1.140: ICMP echo request, id 40, seq 69, length 64
2024-02-20T15:38:11 15:38:10.991690 IP 192.168.17.101 > 151.101.1.140: ICMP echo request, id 40, seq 70, length 64
2024-02-20T15:38:11 15:38:11.087114 ARP, Request who-has 192.168.17.1 tell 192.168.17.101, length 28
2024-02-20T15:38:11 15:38:11.087154 ARP, Reply 192.168.17.1 is-at d8:3a:dd:7d:e0:b5 (oui Unknown), length 28
2024-02-20T15:38:12 15:38:12.015348 IP 192.168.17.101 > 151.101.1.140: ICMP echo request, id 40, seq 71, length 64
2024-02-20T15:38:13 15:38:13.039357 IP 192.168.17.101 > 151.101.1.140: ICMP echo request, id 40, seq 72, length 64
2024-02-20T15:38:14 15:38:14.063352 IP 192.168.17.101 > 151.101.1.140: ICMP echo request, id 40, seq 73, length 64
2024-02-20T15:38:15 15:38:15.087364 IP 192.168.17.101 > 151.101.1.140: ICMP echo request, id 40, seq 74, length 64
2024-02-20T15:38:16 15:38:16.111347 IP 192.168.17.101 > 151.101.1.140: ICMP echo request, id 40, seq 75, length 64
2024-02-20T15:38:17 15:38:17.135321 IP 192.168.17.101 > 151.101.1.140: ICMP echo request, id 40, seq 76, length 64
2024-02-20T15:38:18 15:38:18.159340 IP 192.168.17.101 > 151.101.1.140: ICMP echo request, id 40, seq 77, length 64
2024-02-20T15:38:19 15:38:19.183428 IP 192.168.17.101 > 151.101.1.140: ICMP echo request, id 40, seq 78, length 64
2024-02-20T15:38:20 15:38:20.207342 IP 192.168.17.101 > 151.101.1.140: ICMP echo request, id 40, seq 79, length 64
2024-02-20T15:38:21 15:38:21.231405 IP 192.168.17.101 > 151.101.1.140: ICMP echo request, id 40, seq 80, length 64
2024-02-20T15:38:22 15:38:22.255340 IP 192.168.17.101 > 151.101.1.140: ICMP echo request, id 40, seq 81, length 64
2024-02-20T15:38:23 15:38:23.279336 IP 192.168.17.101 > 151.101.1.140: ICMP echo request, id 40, seq 82, length 64
2024-02-20T15:38:24 15:38:24.304698 IP 192.168.17.101 > 151.101.1.140: ICMP echo request, id 40, seq 83, length 64
2024-02-20T15:38:25 15:38:25.327241 IP 192.168.17.101 > 151.101.1.140: ICMP echo request, id 40, seq 84, length 64
2024-02-20T15:38:26 15:38:26.351360 IP 192.168.17.101 > 151.101.1.140: ICMP echo request, id 40, seq 85, length 64
2024-02-20T15:38:27 15:38:27.375364 IP 192.168.17.101 > 151.101.1.140: ICMP echo request, id 40, seq 86, length 64
2024-02-20T15:38:28 15:38:28.399704 IP 192.168.17.101 > 151.101.1.140: ICMP echo request, id 40, seq 87, length 64
2024-02-20T15:38:29 15:38:29.423342 IP 192.168.17.101 > 151.101.1.140: ICMP echo request, id 40, seq 88, length 64
2024-02-20T15:38:30 15:38:30.447342 IP 192.168.17.101 > 151.101.1.140: ICMP echo request, id 40, seq 89, length 64
2024-02-20T15:38:31 15:38:31.471344 IP 192.168.17.101 > 151.101.1.140: ICMP echo request, id 40, seq 90, length 64
2024-02-20T15:38:32 15:38:32.495311 IP 192.168.17.101 > 151.101.1.140: ICMP echo request, id 40, seq 91, length 64
2024-02-20T15:38:33 15:38:33.519358 IP 192.168.17.101 > 151.101.1.140: ICMP echo request, id 40, seq 92, length 64
2024-02-20T15:38:34 15:38:34.543346 IP 192.168.17.101 > 151.101.1.140: ICMP echo request, id 40, seq 93, length 64
2024-02-20T15:38:36 15:38:35.567341 IP 192.168.17.101 > 151.101.1.140: ICMP echo request, id 40, seq 94, length 64
2024-02-20T15:38:37 15:38:36.591335 IP 192.168.17.101 > 151.101.1.140: ICMP echo request, id 40, seq 95, length 64
2024-02-20T15:38:38 15:38:37.615369 IP 192.168.17.101 > 151.101.1.140: ICMP echo request, id 40, seq 96, length 64
2024-02-20T15:38:39 15:38:38.639354 IP 192.168.17.101 > 151.101.1.140: ICMP echo request, id 40, seq 97, length 64
2024-02-20T15:38:40 15:38:39.663339 IP 192.168.17.101 > 151.101.1.140: ICMP echo request, id 40, seq 98, length 64
2024-02-20T15:38:41 15:38:40.687356 IP 192.168.17.101 > 151.101.1.140: ICMP echo request, id 40, seq 99, length 64
2024-02-20T15:38:42 15:38:41.711351 IP 192.168.17.101 > 151.101.1.140: ICMP echo request, id 40, seq 100, length 64
2024-02-20T15:38:43 15:38:42.735351 IP 192.168.17.101 > 151.101.1.140: ICMP echo request, id 40, seq 101, length 64
2024-02-20T15:38:44 15:38:43.759365 IP 192.168.17.101 > 151.101.1.140: ICMP echo request, id 40, seq 102, length 64
2024-02-20T15:38:45 15:38:44.783360 IP 192.168.17.101 > 151.101.1.140: ICMP echo request, id 40, seq 103, length 64
2024-02-20T15:38:46 15:38:45.807342 IP 192.168.17.101 > 151.101.1.140: ICMP echo request, id 40, seq 104, length 64
2024-02-20T15:38:47 15:38:46.856834 IP 192.168.17.101 > 151.101.1.140: ICMP echo request, id 40, seq 105, length 64
2024-02-20T15:38:48 15:38:47.865057 IP 192.168.17.101 > 151.101.1.140: ICMP echo request, id 40, seq 106, length 64
2024-02-20T15:38:49 15:38:48.919796 IP 192.168.17.101 > 151.101.1.140: ICMP echo request, id 40, seq 107, length 64
2024-02-20T15:38:50 15:38:49.942191 IP 192.168.17.101 > 151.101.1.140: ICMP echo request, id 40, seq 108, length 64
2024-02-20T15:38:51 15:38:50.941825 IP 192.168.17.101 > 151.101.1.140: ICMP echo request, id 40, seq 109, length 64
2024-02-20T15:38:52 15:38:51.988744 IP 192.168.17.101 > 151.101.1.140: ICMP echo request, id 40, seq 110, length 64
2024-02-20T15:38:53 15:38:52.975358 IP 192.168.17.101 > 151.101.1.140: ICMP echo request, id 40, seq 111, length 64
2024-02-20T15:38:54 15:38:53.999343 IP 192.168.17.101 > 151.101.1.140: ICMP echo request, id 40, seq 112, length 64
2024-02-20T15:38:54 15:38:54.095038 ARP, Request who-has 192.168.17.1 tell 192.168.17.101, length 28
2024-02-20T15:38:54 15:38:54.095080 ARP, Reply 192.168.17.1 is-at d8:3a:dd:7d:e0:b5 (oui Unknown), length 28
2024-02-20T15:38:55 15:38:55.023344 IP 192.168.17.101 > 151.101.1.140: ICMP echo request, id 40, seq 113, length 64
2024-02-20T15:38:56 15:38:56.047342 IP 192.168.17.101 > 151.101.1.140: ICMP echo request, id 40, seq 114, length 64
2024-02-20T15:38:57 15:38:57.071339 IP 192.168.17.101 > 151.101.1.140: ICMP echo request, id 40, seq 115, length 64
2024-02-20T15:38:58 15:38:58.095359 IP 192.168.17.101 > 151.101.1.140: ICMP echo request, id 40, seq 116, length 64
2024-02-20T15:38:59 15:38:59.119351 IP 192.168.17.101 > 151.101.1.140: ICMP echo request, id 40, seq 117, length 64
2024-02-20T15:39:00 15:39:00.143332 IP 192.168.17.101 > 151.101.1.140: ICMP echo request, id 40, seq 118, length 64
2024-02-20T15:39:01 15:39:01.167405 IP 192.168.17.101 > 151.101.1.140: ICMP echo request, id 40, seq 119, length 64
2024-02-20T15:39:02 15:39:02.191301 IP 192.168.17.101 > 151.101.1.140: ICMP echo request, id 40, seq 120, length 64
2024-02-20T15:39:03 15:39:03.215341 IP 192.168.17.101 > 151.101.1.140: ICMP echo request, id 40, seq 121, length 64
2024-02-20T15:39:04 15:39:04.239339 IP 192.168.17.101 > 151.101.1.140: ICMP echo request, id 40, seq 122, length 64
2024-02-20T15:39:05 15:39:05.263339 IP 192.168.17.101 > 151.101.1.140: ICMP echo request, id 40, seq 123, length 64
2024-02-20T15:39:06 15:39:06.288189 IP 192.168.17.101 > 151.101.1.140: ICMP echo request, id 40, seq 124, length 64
2024-02-20T15:39:07 15:39:07.311359 IP 192.168.17.101 > 151.101.1.140: ICMP echo request, id 40, seq 125, length 64
2024-02-20T15:39:08 15:39:08.335350 IP 192.168.17.101 > 151.101.1.140: ICMP echo request, id 40, seq 126, length 64
2024-02-20T15:39:09 15:39:09.359336 IP 192.168.17.101 > 151.101.1.140: ICMP echo request, id 40, seq 127, length 64
2024-02-20T15:39:10 15:39:10.383436 IP 192.168.17.101 > 151.101.1.140: ICMP echo request, id 40, seq 128, length 64
2024-02-20T15:39:11 15:39:11.407334 IP 192.168.17.101 > 151.101.1.140: ICMP echo request, id 40, seq 129, length 64
2024-02-20T15:39:12 15:39:12.431321 IP 192.168.17.101 > 151.101.1.140: ICMP echo request, id 40, seq 130, length 64
2024-02-20T15:39:13 15:39:13.455366 IP 192.168.17.101 > 151.101.1.140: ICMP echo request, id 40, seq 131, length 64
2024-02-20T15:39:14 15:39:14.479328 IP 192.168.17.101 > 151.101.1.140: ICMP echo request, id 40, seq 132, length 64
2024-02-20T15:39:15 15:39:15.503354 IP 192.168.17.101 > 151.101.1.140: ICMP echo request, id 40, seq 133, length 64
2024-02-20T15:39:16 15:39:16.527361 IP 192.168.17.101 > 151.101.1.140: ICMP echo request, id 40, seq 134, length 64
2024-02-20T15:39:18 15:39:17.551903 IP 192.168.17.101 > 151.101.1.140: ICMP echo request, id 40, seq 135, length 64
2024-02-20T15:39:19 15:39:18.575359 IP 192.168.17.101 > 151.101.1.140: ICMP echo request, id 40, seq 136, length 64
2024-02-20T15:39:20 15:39:19.599342 IP 192.168.17.101 > 151.101.1.140: ICMP echo request, id 40, seq 137, length 64
2024-02-20T15:39:21 15:39:20.623343 IP 192.168.17.101 > 151.101.1.140: ICMP echo request, id 40, seq 138, length 64
2024-02-20T15:39:22 15:39:21.647358 IP 192.168.17.101 > 151.101.1.140: ICMP echo request, id 40, seq 139, length 64
2024-02-20T15:39:23 15:39:22.671352 IP 192.168.17.101 > 151.101.1.140: ICMP echo request, id 40, seq 140, length 64
2024-02-20T15:39:24 15:39:23.696279 IP 192.168.17.101 > 151.101.1.140: ICMP echo request, id 40, seq 141, length 64
2024-02-20T15:39:25 15:39:24.719352 IP 192.168.17.101 > 151.101.1.140: ICMP echo request, id 40, seq 142, length 64
2024-02-20T15:39:26 15:39:25.743430 IP 192.168.17.101 > 151.101.1.140: ICMP echo request, id 40, seq 143, length 64
2024-02-20T15:39:27 15:39:26.767370 IP 192.168.17.101 > 151.101.1.140: ICMP echo request, id 40, seq 144, length 64
2024-02-20T15:39:28 15:39:27.791346 IP 192.168.17.101 > 151.101.1.140: ICMP echo request, id 40, seq 145, length 64
2024-02-20T15:39:29 15:39:28.815338 IP 192.168.17.101 > 151.101.1.140: ICMP echo request, id 40, seq 146, length 64
2024-02-20T15:39:30 15:39:29.839342 IP 192.168.17.101 > 151.101.1.140: ICMP echo request, id 40, seq 147, length 64
2024-02-20T15:39:31 15:39:30.863345 IP 192.168.17.101 > 151.101.1.140: ICMP echo request, id 40, seq 148, length 64
2024-02-20T15:39:32 15:39:31.887344 IP 192.168.17.101 > 151.101.1.140: ICMP echo request, id 40, seq 149, length 64
2024-02-20T15:39:33 15:39:32.911352 IP 192.168.17.101 > 151.101.1.140: ICMP echo request, id 40, seq 150, length 64
2024-02-20T15:39:34 15:39:33.935350 IP 192.168.17.101 > 151.101.1.140: ICMP echo request, id 40, seq 151, length 64
2024-02-20T15:39:35 15:39:34.959350 IP 192.168.17.101 > 151.101.1.140: ICMP echo request, id 40, seq 152, length 64
2024-02-20T15:39:36 15:39:35.983333 IP 192.168.17.101 > 151.101.1.140: ICMP echo request, id 40, seq 153, length 64
2024-02-20T15:39:37 15:39:37.007328 IP 192.168.17.101 > 151.101.1.140: ICMP echo request, id 40, seq 154, length 64
2024-02-20T15:39:37 15:39:37.103064 ARP, Request who-has 192.168.17.1 tell 192.168.17.101, length 28
2024-02-20T15:39:37 15:39:37.103123 ARP, Reply 192.168.17.1 is-at d8:3a:dd:7d:e0:b5 (oui Unknown), length 28
2024-02-20T15:39:38 15:39:38.031365 IP 192.168.17.101 > 151.101.1.140: ICMP echo request, id 40, seq 155, length 64
2024-02-20T15:39:39 15:39:39.055362 IP 192.168.17.101 > 151.101.1.140: ICMP echo request, id 40, seq 156, length 64
2024-02-20T15:39:40 15:39:40.079348 IP 192.168.17.101 > 151.101.1.140: ICMP echo request, id 40, seq 157, length 64
2024-02-20T15:39:41 15:39:41.103331 IP 192.168.17.101 > 151.101.1.140: ICMP echo request, id 40, seq 158, length 64
2024-02-20T15:39:42 15:39:42.127335 IP 192.168.17.101 > 151.101.1.140: ICMP echo request, id 40, seq 159, length 64
2024-02-20T15:39:43 15:39:43.151336 IP 192.168.17.101 > 151.101.1.140: ICMP echo request, id 40, seq 160, length 64
2024-02-20T15:39:44 15:39:44.175336 IP 192.168.16.123 > 151.101.1.140: ICMP echo request, id 40, seq 161, length 64
2024-02-20T15:39:45 15:39:45.199387 IP 192.168.16.123 > 151.101.1.140: ICMP echo request, id 40, seq 162, length 64
2024-02-20T15:39:46 15:39:46.223347 IP 192.168.16.123 > 151.101.1.140: ICMP echo request, id 40, seq 163, length 64
2024-02-20T15:39:47 15:39:47.247347 IP 192.168.16.123 > 151.101.1.140: ICMP echo request, id 40, seq 164, length 64
2024-02-20T15:39:48 15:39:48.271391 IP 192.168.16.123 > 151.101.1.140: ICMP echo request, id 40, seq 165, length 64
2024-02-20T15:39:49 15:39:49.304090 IP 192.168.16.123 > 151.101.1.140: ICMP echo request, id 40, seq 166, length 64
2024-02-20T15:39:50 15:39:50.319998 IP 192.168.16.123 > 151.101.1.140: ICMP echo request, id 40, seq 167, length 64
2024-02-20T15:39:51 15:39:51.343369 IP 192.168.16.123 > 151.101.1.140: ICMP echo request, id 40, seq 168, length 64
2024-02-20T15:39:52 15:39:52.367345 IP 192.168.16.123 > 151.101.1.140: ICMP echo request, id 40, seq 169, length 64
2024-02-20T15:39:52 15:39:52.367345 IP 192.168.16.121 > 151.101.1.149: ICMP echo request, id 40, seq 169, length 64