2024-02-29T10:35:03 10:35:03.504450 IP6 fe80::48bd:ebf3:eee0:b08 > ip6-allrouters: ICMP6, router solicitation, length 8
2024-02-29T10:35:56 10:35:55.431622 IP6 fe80::48bd:ebf3:eee0:b08.mdns > ff02::fb.mdns: 0 [9q] PTR (QM)? _nfs._tcp.local. PTR (QM)? _ipp._tcp.local. PTR (QM)? _ipps._tcp.local. PTR (QM)? _ftp._tcp.local. PTR (QM)? _webdav._tcp.local. PTR (QM)? _webdavs._tcp.local. PTR (QM)? _sftp-ssh._tcp.local. PTR (QM)? _smb._tcp.local. PTR (QM)? _afpovertcp._tcp.local. (141)
2024-02-29T10:35:56 10:35:55.447718 IP 192.168.17.101.mdns > mdns.mcast.net.mdns: 0 [9q] PTR (QM)? _nfs._tcp.local. PTR (QM)? _ipp._tcp.local. PTR (QM)? _ipps._tcp.local. PTR (QM)? _ftp._tcp.local. PTR (QM)? _webdav._tcp.local. PTR (QM)? _webdavs._tcp.local. PTR (QM)? _sftp-ssh._tcp.local. PTR (QM)? _smb._tcp.local. PTR (QM)? _afpovertcp._tcp.local. (141)
2024-02-29T10:39:38 10:39:37.700515 IP 0.0.0.0.bootpc > 255.255.255.255.bootps: BOOTP/DHCP, Request from d8:3a:dd:36:66:78 (oui Unknown), length 298
2024-02-29T10:39:38 10:39:37.707378 IP 192.168.17.1.bootps > 192.168.17.101.bootpc: BOOTP/DHCP, Reply, length 308
2024-02-29T10:39:38 10:39:37.712914 IP6 :: > ff02::16: HBH ICMP6, multicast listener report v2, 2 group record(s), length 48
2024-02-29T10:39:38 10:39:37.742361 IP 192.168.17.101 > igmp.mcast.net: igmp v3 report, 1 group record(s)
2024-02-29T10:39:38 10:39:37.744284 ARP, Request who-has 192.168.17.101 tell 192.168.17.101, length 28
2024-02-29T10:39:38 10:39:37.835570 IP 192.168.17.101.mdns > mdns.mcast.net.mdns: 0 [9q] PTR (QM)? _nfs._tcp.local. PTR (QM)? _ipp._tcp.local. PTR (QM)? _ipps._tcp.local. PTR (QM)? _ftp._tcp.local. PTR (QM)? _webdav._tcp.local. PTR (QM)? _webdavs._tcp.local. PTR (QM)? _sftp-ssh._tcp.local. PTR (QM)? _smb._tcp.local. PTR (QM)? _afpovertcp._tcp.local. (141)
2024-02-29T10:39:38 10:39:37.945440 IP 192.168.17.101 > igmp.mcast.net: igmp v3 report, 1 group record(s)
2024-02-29T10:39:38 10:39:37.965823 IP 192.168.17.101.mdns > mdns.mcast.net.mdns: 0 [4q] [6n] ANY (QM)? 8.0.b.0.0.e.e.e.3.f.b.e.d.b.8.4.0.0.0.0.0.0.0.0.0.0.0.0.0.8.e.f.ip6.arpa. ANY (QM)? nqm-perfect-pi.local. ANY (QM)? 101.17.168.192.in-addr.arpa. ANY (QM)? nqm-perfect-pi Demo Server._demo-server._tcp.local. (301)
2024-02-29T10:39:38 10:39:38.012160 IP 192.168.17.101.mdns > mdns.mcast.net.mdns: 0*- [0q] 2/0/0 PTR _demo-server._tcp.local., PTR nqm-perfect-pi Demo Server._demo-server._tcp.local. (113)
2024-02-29T10:39:38 10:39:38.219309 IP 192.168.17.101.mdns > mdns.mcast.net.mdns: 0 [4q] [6n] ANY (QM)? 8.0.b.0.0.e.e.e.3.f.b.e.d.b.8.4.0.0.0.0.0.0.0.0.0.0.0.0.0.8.e.f.ip6.arpa. ANY (QM)? nqm-perfect-pi.local. ANY (QM)? 101.17.168.192.in-addr.arpa. ANY (QM)? nqm-perfect-pi Demo Server._demo-server._tcp.local. (301)
2024-02-29T10:39:39 10:39:38.365506 IP6 :: > ff02::16: HBH ICMP6, multicast listener report v2, 2 group record(s), length 48
2024-02-29T10:39:39 10:39:38.462038 IP6 :: > ff02::1:ffe0:b08: ICMP6, neighbor solicitation, who has fe80::48bd:ebf3:eee0:b08, length 32
2024-02-29T10:39:39 10:39:38.466270 IP 192.168.17.101.mdns > mdns.mcast.net.mdns: 0 [4q] [6n] ANY (QM)? 8.0.b.0.0.e.e.e.3.f.b.e.d.b.8.4.0.0.0.0.0.0.0.0.0.0.0.0.0.8.e.f.ip6.arpa. ANY (QM)? nqm-perfect-pi.local. ANY (QM)? 101.17.168.192.in-addr.arpa. ANY (QM)? nqm-perfect-pi Demo Server._demo-server._tcp.local. (301)
2024-02-29T10:39:39 10:39:38.670521 IP 192.168.17.101.mdns > mdns.mcast.net.mdns: 0*- [0q] 6/0/0 (Cache flush) PTR nqm-perfect-pi.local., (Cache flush) A 192.168.17.101, (Cache flush) PTR nqm-perfect-pi.local., (Cache flush) SRV nqm-perfect-pi.local.:8082 0 0, (Cache flush) TXT "", (Cache flush) AAAA fe80::48bd:ebf3:eee0:b08 (277)
2024-02-29T10:39:39 10:39:38.836507 IP 192.168.17.101.mdns > mdns.mcast.net.mdns: 0 [9q] PTR (QM)? _nfs._tcp.local. PTR (QM)? _ipp._tcp.local. PTR (QM)? _ipps._tcp.local. PTR (QM)? _ftp._tcp.local. PTR (QM)? _webdav._tcp.local. PTR (QM)? _webdavs._tcp.local. PTR (QM)? _sftp-ssh._tcp.local. PTR (QM)? _smb._tcp.local. PTR (QM)? _afpovertcp._tcp.local. (141)
2024-02-29T10:39:39 10:39:39.194893 IP 192.168.17.101.mdns > mdns.mcast.net.mdns: 0*- [0q] 6/0/0 PTR _demo-server._tcp.local., PTR nqm-perfect-pi Demo Server._demo-server._tcp.local., (Cache flush) TXT "", (Cache flush) SRV nqm-perfect-pi.local.:8082 0 0, (Cache flush) AAAA fe80::48bd:ebf3:eee0:b08, (Cache flush) A 192.168.17.101 (205)
2024-02-29T10:39:40 10:39:39.485541 IP6 fe80::48bd:ebf3:eee0:b08 > ff02::16: HBH ICMP6, multicast listener report v2, 2 group record(s), length 48
2024-02-29T10:39:40 10:39:39.597600 IP6 fe80::48bd:ebf3:eee0:b08 > ip6-allrouters: ICMP6, router solicitation, length 8
2024-02-29T10:39:40 10:39:39.748518 ARP, Request who-has 192.168.17.101 tell 192.168.17.101, length 28
2024-02-29T10:39:40 10:39:39.829266 IP6 fe80::48bd:ebf3:eee0:b08.mdns > ff02::fb.mdns: 0*- [0q] 3/0/0 (Cache flush) TXT "", (Cache flush) SRV nqm-perfect-pi.local.:8082 0 0, (Cache flush) AAAA fe80::48bd:ebf3:eee0:b08 (138)
2024-02-29T10:39:40 10:39:39.851139 IP 192.168.17.101.mdns > mdns.mcast.net.mdns: 0*- [0q] 6/0/0 (Cache flush) PTR nqm-perfect-pi.local., (Cache flush) A 192.168.17.101, (Cache flush) PTR nqm-perfect-pi.local., (Cache flush) SRV nqm-perfect-pi.local.:8082 0 0, (Cache flush) TXT "", (Cache flush) AAAA fe80::48bd:ebf3:eee0:b08 (277)
2024-02-29T10:39:40 10:39:39.851309 IP6 fe80::48bd:ebf3:eee0:b08.mdns > ff02::fb.mdns: 0*- [0q] 1/0/0 (Cache flush) PTR nqm-perfect-pi.local. (118)
2024-02-29T10:39:40 10:39:39.892127 IP6 fe80::48bd:ebf3:eee0:b08.mdns > ff02::fb.mdns: 0 PTR (QM)? _registrar._tcp.local. (39)
2024-02-29T10:39:40 10:39:39.892238 IP 192.168.17.101.mdns > mdns.mcast.net.mdns: 0 PTR (QM)? _registrar._tcp.local. (39)
2024-02-29T10:39:40 10:39:40.010687 IP 192.168.17.1.mdns > mdns.mcast.net.mdns: 0*- [0q] 4/0/0 PTR registrarOffice-registrar._registrar._tcp.local., (Cache flush) TXT "", (Cache flush) SRV registrarOffice.local.:12345 0 0, (Cache flush) A 192.168.17.1 (138)
2024-02-29T10:39:41 10:39:40.413569 IP6 fe80::48bd:ebf3:eee0:b08 > ff02::16: HBH ICMP6, multicast listener report v2, 2 group record(s), length 48
2024-02-29T10:39:41 10:39:40.804601 IP6 fe80::48bd:ebf3:eee0:b08.mdns > ff02::fb.mdns: 0 [9q] PTR (QM)? _nfs._tcp.local. PTR (QM)? _ipp._tcp.local. PTR (QM)? _ipps._tcp.local. PTR (QM)? _ftp._tcp.local. PTR (QM)? _webdav._tcp.local. PTR (QM)? _webdavs._tcp.local. PTR (QM)? _sftp-ssh._tcp.local. PTR (QM)? _smb._tcp.local. PTR (QM)? _afpovertcp._tcp.local. (141)
2024-02-29T10:39:41 10:39:40.833664 IP 192.168.17.101.mdns > mdns.mcast.net.mdns: 0 [9q] PTR (QM)? _nfs._tcp.local. PTR (QM)? _ipp._tcp.local. PTR (QM)? _ipps._tcp.local. PTR (QM)? _ftp._tcp.local. PTR (QM)? _webdav._tcp.local. PTR (QM)? _webdavs._tcp.local. PTR (QM)? _sftp-ssh._tcp.local. PTR (QM)? _smb._tcp.local. PTR (QM)? _afpovertcp._tcp.local. (141)
2024-02-29T10:39:41 10:39:41.343083 IP6 fe80::48bd:ebf3:eee0:b08.mdns > ff02::fb.mdns: 0*- [0q] 5/0/0 PTR _demo-server._tcp.local., PTR nqm-perfect-pi Demo Server._demo-server._tcp.local., (Cache flush) TXT "", (Cache flush) SRV nqm-perfect-pi.local.:8082 0 0, (Cache flush) AAAA fe80::48bd:ebf3:eee0:b08 (189)
2024-02-29T10:39:41 10:39:41.378822 IP 192.168.17.101.mdns > mdns.mcast.net.mdns: 0*- [0q] 6/0/0 PTR _demo-server._tcp.local., PTR nqm-perfect-pi Demo Server._demo-server._tcp.local., (Cache flush) TXT "", (Cache flush) SRV nqm-perfect-pi.local.:8082 0 0, (Cache flush) AAAA fe80::48bd:ebf3:eee0:b08, (Cache flush) A 192.168.17.101 (205)
2024-02-29T10:39:42 10:39:41.746677 ARP, Request who-has 192.168.17.101 tell 192.168.17.101, length 28
2024-02-29T10:39:42 10:39:42.003352 IP6 fe80::48bd:ebf3:eee0:b08.mdns > ff02::fb.mdns: 0*- [0q] 3/0/0 (Cache flush) TXT "", (Cache flush) SRV nqm-perfect-pi.local.:8082 0 0, (Cache flush) AAAA fe80::48bd:ebf3:eee0:b08 (138)
2024-02-29T10:39:42 10:39:42.032324 IP 192.168.17.101.mdns > mdns.mcast.net.mdns: 0*- [0q] 6/0/0 (Cache flush) PTR nqm-perfect-pi.local., (Cache flush) A 192.168.17.101, (Cache flush) PTR nqm-perfect-pi.local., (Cache flush) SRV nqm-perfect-pi.local.:8082 0 0, (Cache flush) TXT "", (Cache flush) AAAA fe80::48bd:ebf3:eee0:b08 (277)
2024-02-29T10:39:42 10:39:42.032459 IP6 fe80::48bd:ebf3:eee0:b08.mdns > ff02::fb.mdns: 0*- [0q] 1/0/0 (Cache flush) PTR nqm-perfect-pi.local. (118)
2024-02-29T10:39:43 10:39:42.762959 ARP, Request who-has 192.168.17.101 tell 192.168.17.1, length 28
2024-02-29T10:39:43 10:39:42.766742 ARP, Reply 192.168.17.101 is-at d8:3a:dd:36:66:78 (oui Unknown), length 28
2024-02-29T10:39:43 10:39:42.982327 ARP, Request who-has 192.168.17.1 tell 192.168.17.101, length 28
2024-02-29T10:39:43 10:39:42.982363 ARP, Reply 192.168.17.1 is-at d8:3a:dd:7d:e0:b5 (oui Unknown), length 28
2024-02-29T10:39:43 10:39:42.983993 IP 192.168.17.101.56604 > 192.168.17.1.12345: Flags [S], seq 2924125889, win 64240, options [mss 1460,sackOK,TS val 1291486592 ecr 0,nop,wscale 7], length 0
2024-02-29T10:39:43 10:39:42.984080 IP 192.168.17.1.12345 > 192.168.17.101.56604: Flags [S.], seq 3546915833, ack 2924125890, win 65160, options [mss 1460,sackOK,TS val 2827539373 ecr 1291486592,nop,wscale 7], length 0
2024-02-29T10:39:43 10:39:42.985424 IP 192.168.17.101.56604 > 192.168.17.1.12345: Flags [.], ack 1, win 502, options [nop,nop,TS val 1291486598 ecr 2827539373], length 0
2024-02-29T10:39:43 10:39:43.000593 IP 192.168.17.101.56604 > 192.168.17.1.12345: Flags [P.], seq 1:226, ack 1, win 502, options [nop,nop,TS val 1291486607 ecr 2827539373], length 225
2024-02-29T10:39:43 10:39:43.000696 IP 192.168.17.1.12345 > 192.168.17.101.56604: Flags [.], ack 226, win 508, options [nop,nop,TS val 2827539389 ecr 1291486607], length 0
2024-02-29T10:39:43 10:39:43.004457 IP 192.168.17.1.12345 > 192.168.17.101.56604: Flags [P.], seq 1:777, ack 226, win 508, options [nop,nop,TS val 2827539393 ecr 1291486607], length 776
2024-02-29T10:39:43 10:39:43.010662 IP 192.168.17.101.56604 > 192.168.17.1.12345: Flags [.], ack 777, win 501, options [nop,nop,TS val 1291486623 ecr 2827539393], length 0
2024-02-29T10:39:43 10:39:43.017214 IP 192.168.17.101.56604 > 192.168.17.1.12345: Flags [P.], seq 226:336, ack 777, win 501, options [nop,nop,TS val 1291486627 ecr 2827539393], length 110
2024-02-29T10:39:43 10:39:43.017443 IP 192.168.17.1.12345 > 192.168.17.101.56604: Flags [P.], seq 777:801, ack 336, win 508, options [nop,nop,TS val 2827539406 ecr 1291486627], length 24
2024-02-29T10:39:43 10:39:43.017655 IP 192.168.17.1.12345 > 192.168.17.101.56604: Flags [F.], seq 801, ack 336, win 508, options [nop,nop,TS val 2827539406 ecr 1291486627], length 0
2024-02-29T10:39:43 10:39:43.017764 IP 192.168.17.1.12345 > 192.168.17.101.56604: Flags [R.], seq 802, ack 336, win 508, options [nop,nop,TS val 2827539406 ecr 1291486627], length 0
2024-02-29T10:39:43 10:39:43.021724 IP 192.168.17.101.56604 > 192.168.17.1.12345: Flags [F.], seq 336, ack 802, win 501, options [nop,nop,TS val 1291486631 ecr 2827539406], length 0
2024-02-29T10:39:43 10:39:43.021784 IP 192.168.17.1.12345 > 192.168.17.101.56604: Flags [R], seq 3546916635, win 0, length 0
2024-02-29T10:39:44 10:39:43.515707 IP6 fe80::48bd:ebf3:eee0:b08 > ip6-allrouters: ICMP6, router solicitation, length 8
2024-02-29T10:39:44 10:39:43.771727 IP 192.168.17.101.56614 > 192.168.17.1.12345: Flags [S], seq 3563437578, win 64240, options [mss 1460,sackOK,TS val 1291487381 ecr 0,nop,wscale 7], length 0
2024-02-29T10:39:44 10:39:43.771856 IP 192.168.17.1.12345 > 192.168.17.101.56614: Flags [S.], seq 4013742749, ack 3563437579, win 65160, options [mss 1460,sackOK,TS val 2827540160 ecr 1291487381,nop,wscale 7], length 0
2024-02-29T10:39:44 10:39:43.773494 IP 192.168.17.101.56614 > 192.168.17.1.12345: Flags [.], ack 1, win 502, options [nop,nop,TS val 1291487386 ecr 2827540160], length 0
2024-02-29T10:39:44 10:39:43.796454 IP 192.168.17.101.56614 > 192.168.17.1.12345: Flags [P.], seq 1:220, ack 1, win 502, options [nop,nop,TS val 1291487409 ecr 2827540160], length 219
2024-02-29T10:39:44 10:39:43.796553 IP 192.168.17.1.12345 > 192.168.17.101.56614: Flags [.], ack 220, win 508, options [nop,nop,TS val 2827540185 ecr 1291487409], length 0
2024-02-29T10:39:44 10:39:43.800200 IP 192.168.17.1.12345 > 192.168.17.101.56614: Flags [P.], seq 1:776, ack 220, win 508, options [nop,nop,TS val 2827540189 ecr 1291487409], length 775
2024-02-29T10:39:44 10:39:43.801913 IP 192.168.17.101.56614 > 192.168.17.1.12345: Flags [.], ack 776, win 501, options [nop,nop,TS val 1291487414 ecr 2827540189], length 0
2024-02-29T10:39:45 10:39:44.804446 IP6 fe80::48bd:ebf3:eee0:b08.mdns > ff02::fb.mdns: 0 [9q] PTR (QM)? _nfs._tcp.local. PTR (QM)? _ipp._tcp.local. PTR (QM)? _ipps._tcp.local. PTR (QM)? _ftp._tcp.local. PTR (QM)? _webdav._tcp.local. PTR (QM)? _webdavs._tcp.local. PTR (QM)? _sftp-ssh._tcp.local. PTR (QM)? _smb._tcp.local. PTR (QM)? _afpovertcp._tcp.local. (141)
2024-02-29T10:39:45 10:39:44.852155 IP 192.168.17.101.mdns > mdns.mcast.net.mdns: 0 [9q] PTR (QM)? _nfs._tcp.local. PTR (QM)? _ipp._tcp.local. PTR (QM)? _ipps._tcp.local. PTR (QM)? _ftp._tcp.local. PTR (QM)? _webdav._tcp.local. PTR (QM)? _webdavs._tcp.local. PTR (QM)? _sftp-ssh._tcp.local. PTR (QM)? _smb._tcp.local. PTR (QM)? _afpovertcp._tcp.local. (141)
2024-02-29T10:39:45 10:39:45.431806 IP 192.168.17.101.56614 > 192.168.17.1.12345: Flags [P.], seq 220:806, ack 776, win 501, options [nop,nop,TS val 1291489041 ecr 2827540189], length 586
2024-02-29T10:39:45 10:39:45.438312 IP 192.168.17.1.12345 > 192.168.17.101.56614: Flags [P.], seq 776:1399, ack 806, win 504, options [nop,nop,TS val 2827541827 ecr 1291489041], length 623
2024-02-29T10:39:45 10:39:45.441309 IP 192.168.17.101.56614 > 192.168.17.1.12345: Flags [.], seq 806:2254, ack 776, win 501, options [nop,nop,TS val 1291489041 ecr 2827540189], length 1448
2024-02-29T10:39:45 10:39:45.441378 IP 192.168.17.101.56614 > 192.168.17.1.12345: Flags [P.], seq 2254:2946, ack 776, win 501, options [nop,nop,TS val 1291489041 ecr 2827540189], length 692
2024-02-29T10:39:45 10:39:45.441398 IP 192.168.17.101.56614 > 192.168.17.1.12345: Flags [FP.], seq 2946:2970, ack 776, win 501, options [nop,nop,TS val 1291489042 ecr 2827540189], length 24
2024-02-29T10:39:45 10:39:45.441485 IP 192.168.17.1.12345 > 192.168.17.101.56614: Flags [.], ack 2971, win 494, options [nop,nop,TS val 2827541830 ecr 1291489041], length 0
2024-02-29T10:39:45 10:39:45.441534 IP 192.168.17.101.56614 > 192.168.17.1.12345: Flags [.], ack 1399, win 501, options [nop,nop,TS val 1291489052 ecr 2827541827], length 0
2024-02-29T10:39:45 10:39:45.441581 IP 192.168.17.1.12345 > 192.168.17.101.56614: Flags [P.], seq 1399:2022, ack 2971, win 501, options [nop,nop,TS val 2827541830 ecr 1291489052], length 623
2024-02-29T10:39:45 10:39:45.443249 IP 192.168.17.101.56614 > 192.168.17.1.12345: Flags [.], ack 2022, win 501, options [nop,nop,TS val 1291489056 ecr 2827541830], length 0
2024-02-29T10:39:45 10:39:45.443481 IP 192.168.17.1.12345 > 192.168.17.101.56614: Flags [P.], seq 2022:2192, ack 2971, win 501, options [nop,nop,TS val 2827541832 ecr 1291489056], length 170
2024-02-29T10:39:45 10:39:45.444004 IP 192.168.17.1.12345 > 192.168.17.101.56614: Flags [FP.], seq 2192:2386, ack 2971, win 501, options [nop,nop,TS val 2827541833 ecr 1291489056], length 194
2024-02-29T10:39:45 10:39:45.445198 IP 192.168.17.101.56614 > 192.168.17.1.12345: Flags [.], ack 2192, win 501, options [nop,nop,TS val 1291489057 ecr 2827541832], length 0
2024-02-29T10:39:45 10:39:45.445422 IP 192.168.17.101.56614 > 192.168.17.1.12345: Flags [.], ack 2387, win 501, options [nop,nop,TS val 1291489058 ecr 2827541833], length 0
2024-02-29T10:39:51 10:39:51.585577 IP6 fe80::48bd:ebf3:eee0:b08 > ip6-allrouters: ICMP6, router solicitation, length 8
2024-02-29T10:39:53 10:39:52.806609 IP6 fe80::48bd:ebf3:eee0:b08.mdns > ff02::fb.mdns: 0 [9q] PTR (QM)? _nfs._tcp.local. PTR (QM)? _ipp._tcp.local. PTR (QM)? _ipps._tcp.local. PTR (QM)? _ftp._tcp.local. PTR (QM)? _webdav._tcp.local. PTR (QM)? _webdavs._tcp.local. PTR (QM)? _sftp-ssh._tcp.local. PTR (QM)? _smb._tcp.local. PTR (QM)? _afpovertcp._tcp.local. (141)
2024-02-29T10:39:53 10:39:52.841619 IP 192.168.17.101.mdns > mdns.mcast.net.mdns: 0 [9q] PTR (QM)? _nfs._tcp.local. PTR (QM)? _ipp._tcp.local. PTR (QM)? _ipps._tcp.local. PTR (QM)? _ftp._tcp.local. PTR (QM)? _webdav._tcp.local. PTR (QM)? _webdavs._tcp.local. PTR (QM)? _sftp-ssh._tcp.local. PTR (QM)? _smb._tcp.local. PTR (QM)? _afpovertcp._tcp.local. (141)
2024-02-29T10:40:06 10:40:06.928552 IP6 fe80::48bd:ebf3:eee0:b08 > ip6-allrouters: ICMP6, router solicitation, length 8
2024-02-29T10:40:09 10:40:08.812926 IP6 fe80::48bd:ebf3:eee0:b08.mdns > ff02::fb.mdns: 0 [9q] PTR (QM)? _nfs._tcp.local. PTR (QM)? _ipp._tcp.local. PTR (QM)? _ipps._tcp.local. PTR (QM)? _ftp._tcp.local. PTR (QM)? _webdav._tcp.local. PTR (QM)? _webdavs._tcp.local. PTR (QM)? _sftp-ssh._tcp.local. PTR (QM)? _smb._tcp.local. PTR (QM)? _afpovertcp._tcp.local. (141)
2024-02-29T10:40:09 10:40:08.835615 IP 192.168.17.101.mdns > mdns.mcast.net.mdns: 0 [9q] PTR (QM)? _nfs._tcp.local. PTR (QM)? _ipp._tcp.local. PTR (QM)? _ipps._tcp.local. PTR (QM)? _ftp._tcp.local. PTR (QM)? _webdav._tcp.local. PTR (QM)? _webdavs._tcp.local. PTR (QM)? _sftp-ssh._tcp.local. PTR (QM)? _smb._tcp.local. PTR (QM)? _afpovertcp._tcp.local. (141)
2024-02-29T10:40:39 10:40:38.896942 IP6 fe80::48bd:ebf3:eee0:b08 > ip6-allrouters: ICMP6, router solicitation, length 8
2024-02-29T10:40:41 10:40:40.814503 IP6 fe80::48bd:ebf3:eee0:b08.mdns > ff02::fb.mdns: 0 [9q] PTR (QM)? _nfs._tcp.local. PTR (QM)? _ipp._tcp.local. PTR (QM)? _ipps._tcp.local. PTR (QM)? _ftp._tcp.local. PTR (QM)? _webdav._tcp.local. PTR (QM)? _webdavs._tcp.local. PTR (QM)? _sftp-ssh._tcp.local. PTR (QM)? _smb._tcp.local. PTR (QM)? _afpovertcp._tcp.local. (141)
2024-02-29T10:40:41 10:40:40.834869 IP 192.168.17.101.mdns > mdns.mcast.net.mdns: 0 [9q] PTR (QM)? _nfs._tcp.local. PTR (QM)? _ipp._tcp.local. PTR (QM)? _ipps._tcp.local. PTR (QM)? _ftp._tcp.local. PTR (QM)? _webdav._tcp.local. PTR (QM)? _webdavs._tcp.local. PTR (QM)? _sftp-ssh._tcp.local. PTR (QM)? _smb._tcp.local. PTR (QM)? _afpovertcp._tcp.local. (141)
2024-02-29T10:41:42 10:41:41.918782 IP6 fe80::48bd:ebf3:eee0:b08 > ip6-allrouters: ICMP6, router solicitation, length 8
2024-02-29T10:41:45 10:41:44.816156 IP6 fe80::48bd:ebf3:eee0:b08.mdns > ff02::fb.mdns: 0 [9q] PTR (QM)? _nfs._tcp.local. PTR (QM)? _ipp._tcp.local. PTR (QM)? _ipps._tcp.local. PTR (QM)? _ftp._tcp.local. PTR (QM)? _webdav._tcp.local. PTR (QM)? _webdavs._tcp.local. PTR (QM)? _sftp-ssh._tcp.local. PTR (QM)? _smb._tcp.local. PTR (QM)? _afpovertcp._tcp.local. (141)
2024-02-29T10:41:45 10:41:44.836326 IP 192.168.17.101.mdns > mdns.mcast.net.mdns: 0 [9q] PTR (QM)? _nfs._tcp.local. PTR (QM)? _ipp._tcp.local. PTR (QM)? _ipps._tcp.local. PTR (QM)? _ftp._tcp.local. PTR (QM)? _webdav._tcp.local. PTR (QM)? _webdavs._tcp.local. PTR (QM)? _sftp-ssh._tcp.local. PTR (QM)? _smb._tcp.local. PTR (QM)? _afpovertcp._tcp.local. (141)
2024-02-29T10:41:55 10:41:54.716778 IP 0.0.0.0.bootpc > 255.255.255.255.bootps: BOOTP/DHCP, Request from d8:3a:dd:36:66:78 (oui Unknown), length 298
2024-02-29T10:41:55 10:41:54.723500 IP 192.168.17.1.bootps > 192.168.17.101.bootpc: BOOTP/DHCP, Reply, length 308
2024-02-29T10:41:55 10:41:54.726283 IP6 :: > ff02::16: HBH ICMP6, multicast listener report v2, 2 group record(s), length 48
2024-02-29T10:41:55 10:41:54.758213 IP 192.168.17.101 > igmp.mcast.net: igmp v3 report, 1 group record(s)
2024-02-29T10:41:55 10:41:54.763325 ARP, Request who-has 192.168.17.101 tell 192.168.17.101, length 28
2024-02-29T10:41:55 10:41:54.833513 IP 192.168.17.101 > igmp.mcast.net: igmp v3 report, 1 group record(s)
2024-02-29T10:41:55 10:41:54.833872 IP 192.168.17.101.mdns > mdns.mcast.net.mdns: 0*- [0q] 2/0/0 PTR _demo-server._tcp.local., PTR nqm-perfect-pi Demo Server._demo-server._tcp.local. (113)
2024-02-29T10:41:55 10:41:54.843670 IP 192.168.17.101.mdns > mdns.mcast.net.mdns: 0 [4q] [6n] ANY (QM)? 8.0.b.0.0.e.e.e.3.f.b.e.d.b.8.4.0.0.0.0.0.0.0.0.0.0.0.0.0.8.e.f.ip6.arpa. ANY (QM)? nqm-perfect-pi.local. ANY (QM)? 101.17.168.192.in-addr.arpa. ANY (QM)? nqm-perfect-pi Demo Server._demo-server._tcp.local. (301)
2024-02-29T10:41:55 10:41:54.851179 IP 192.168.17.101.mdns > mdns.mcast.net.mdns: 0 [9q] PTR (QM)? _nfs._tcp.local. PTR (QM)? _ipp._tcp.local. PTR (QM)? _ipps._tcp.local. PTR (QM)? _ftp._tcp.local. PTR (QM)? _webdav._tcp.local. PTR (QM)? _webdavs._tcp.local. PTR (QM)? _sftp-ssh._tcp.local. PTR (QM)? _smb._tcp.local. PTR (QM)? _afpovertcp._tcp.local. (141)
2024-02-29T10:41:55 10:41:54.885185 IP6 :: > ff02::1:ffe0:b08: ICMP6, neighbor solicitation, who has fe80::48bd:ebf3:eee0:b08, length 32
2024-02-29T10:41:55 10:41:55.069237 IP6 :: > ff02::16: HBH ICMP6, multicast listener report v2, 2 group record(s), length 48
2024-02-29T10:41:55 10:41:55.100433 IP 192.168.17.101.mdns > mdns.mcast.net.mdns: 0 [4q] [6n] ANY (QM)? 8.0.b.0.0.e.e.e.3.f.b.e.d.b.8.4.0.0.0.0.0.0.0.0.0.0.0.0.0.8.e.f.ip6.arpa. ANY (QM)? nqm-perfect-pi.local. ANY (QM)? 101.17.168.192.in-addr.arpa. ANY (QM)? nqm-perfect-pi Demo Server._demo-server._tcp.local. (301)
2024-02-29T10:41:55 10:41:55.347492 IP 192.168.17.101.mdns > mdns.mcast.net.mdns: 0 [4q] [6n] ANY (QM)? 8.0.b.0.0.e.e.e.3.f.b.e.d.b.8.4.0.0.0.0.0.0.0.0.0.0.0.0.0.8.e.f.ip6.arpa. ANY (QM)? nqm-perfect-pi.local. ANY (QM)? 101.17.168.192.in-addr.arpa. ANY (QM)? nqm-perfect-pi Demo Server._demo-server._tcp.local. (301)
2024-02-29T10:41:56 10:41:55.546960 IP 192.168.17.101.mdns > mdns.mcast.net.mdns: 0*- [0q] 4/0/0 (Cache flush) PTR nqm-perfect-pi.local., (Cache flush) SRV nqm-perfect-pi.local.:8082 0 0, (Cache flush) TXT "", (Cache flush) AAAA fe80::48bd:ebf3:eee0:b08 (224)
2024-02-29T10:41:56 10:41:55.547125 IP 192.168.17.101.mdns > mdns.mcast.net.mdns: 0*- [0q] 2/0/0 (Cache flush) PTR nqm-perfect-pi.local., (Cache flush) A 192.168.17.101 (89)
2024-02-29T10:41:56 10:41:55.854135 IP 192.168.17.101.mdns > mdns.mcast.net.mdns: 0 [9q] PTR (QM)? _nfs._tcp.local. PTR (QM)? _ipp._tcp.local. PTR (QM)? _ipps._tcp.local. PTR (QM)? _ftp._tcp.local. PTR (QM)? _webdav._tcp.local. PTR (QM)? _webdavs._tcp.local. PTR (QM)? _sftp-ssh._tcp.local. PTR (QM)? _smb._tcp.local. PTR (QM)? _afpovertcp._tcp.local. (141)
2024-02-29T10:41:56 10:41:55.873920 IP 192.168.17.101.mdns > mdns.mcast.net.mdns: 0*- [0q] 2/0/0 PTR _demo-server._tcp.local., PTR nqm-perfect-pi Demo Server._demo-server._tcp.local. (113)
2024-02-29T10:41:56 10:41:55.898135 IP6 fe80::48bd:ebf3:eee0:b08 > ff02::16: HBH ICMP6, multicast listener report v2, 2 group record(s), length 48
2024-02-29T10:41:56 10:41:56.128862 IP6 fe80::48bd:ebf3:eee0:b08 > ip6-allrouters: ICMP6, router solicitation, length 8
2024-02-29T10:41:56 10:41:56.287504 IP6 fe80::48bd:ebf3:eee0:b08 > ff02::16: HBH ICMP6, multicast listener report v2, 2 group record(s), length 48
2024-02-29T10:41:56 10:41:56.550514 IP6 fe80::48bd:ebf3:eee0:b08.mdns > ff02::fb.mdns: 0*- [0q] 3/0/0 (Cache flush) TXT "", (Cache flush) SRV nqm-perfect-pi.local.:8082 0 0, (Cache flush) AAAA fe80::48bd:ebf3:eee0:b08 (138)
2024-02-29T10:41:57 10:41:56.590817 IP 192.168.17.101.mdns > mdns.mcast.net.mdns: 0*- [0q] 5/0/0 (Cache flush) PTR nqm-perfect-pi.local., (Cache flush) SRV nqm-perfect-pi.local.:8082 0 0, (Cache flush) A 192.168.17.101, (Cache flush) TXT "", (Cache flush) AAAA fe80::48bd:ebf3:eee0:b08 (240)
2024-02-29T10:41:57 10:41:56.591018 IP6 fe80::48bd:ebf3:eee0:b08.mdns > ff02::fb.mdns: 0*- [0q] 1/0/0 (Cache flush) PTR nqm-perfect-pi.local. (118)
2024-02-29T10:41:57 10:41:56.595234 IP 192.168.17.101.mdns > mdns.mcast.net.mdns: 0*- [0q] 1/0/0 (Cache flush) PTR nqm-perfect-pi.local. (73)
2024-02-29T10:41:57 10:41:56.766823 ARP, Request who-has 192.168.17.101 tell 192.168.17.101, length 28
2024-02-29T10:41:57 10:41:56.922101 IP6 fe80::48bd:ebf3:eee0:b08.mdns > ff02::fb.mdns: 0 PTR (QM)? _registrar._tcp.local. (39)
2024-02-29T10:41:57 10:41:56.922315 IP 192.168.17.101.mdns > mdns.mcast.net.mdns: 0 PTR (QM)? _registrar._tcp.local. (39)
2024-02-29T10:41:57 10:41:56.978528 IP 192.168.17.1.mdns > mdns.mcast.net.mdns: 0*- [0q] 4/0/0 PTR registrarOffice-registrar._registrar._tcp.local., (Cache flush) TXT "", (Cache flush) SRV registrarOffice.local.:12345 0 0, (Cache flush) A 192.168.17.1 (138)
2024-02-29T10:41:58 10:41:57.812951 IP6 fe80::48bd:ebf3:eee0:b08.mdns > ff02::fb.mdns: 0 [9q] PTR (QM)? _nfs._tcp.local. PTR (QM)? _ipp._tcp.local. PTR (QM)? _ipps._tcp.local. PTR (QM)? _ftp._tcp.local. PTR (QM)? _webdav._tcp.local. PTR (QM)? _webdavs._tcp.local. PTR (QM)? _sftp-ssh._tcp.local. PTR (QM)? _smb._tcp.local. PTR (QM)? _afpovertcp._tcp.local. (141)
2024-02-29T10:41:58 10:41:57.855099 IP 192.168.17.101.mdns > mdns.mcast.net.mdns: 0 [9q] PTR (QM)? _nfs._tcp.local. PTR (QM)? _ipp._tcp.local. PTR (QM)? _ipps._tcp.local. PTR (QM)? _ftp._tcp.local. PTR (QM)? _webdav._tcp.local. PTR (QM)? _webdavs._tcp.local. PTR (QM)? _sftp-ssh._tcp.local. PTR (QM)? _smb._tcp.local. PTR (QM)? _afpovertcp._tcp.local. (141)
2024-02-29T10:41:58 10:41:57.875514 IP6 fe80::48bd:ebf3:eee0:b08.mdns > ff02::fb.mdns: 0*- [0q] 5/0/0 PTR _demo-server._tcp.local., PTR nqm-perfect-pi Demo Server._demo-server._tcp.local., (Cache flush) TXT "", (Cache flush) SRV nqm-perfect-pi.local.:8082 0 0, (Cache flush) AAAA fe80::48bd:ebf3:eee0:b08 (189)
2024-02-29T10:41:58 10:41:57.918576 IP 192.168.17.101.mdns > mdns.mcast.net.mdns: 0*- [0q] 6/0/0 PTR _demo-server._tcp.local., PTR nqm-perfect-pi Demo Server._demo-server._tcp.local., (Cache flush) TXT "", (Cache flush) SRV nqm-perfect-pi.local.:8082 0 0, (Cache flush) AAAA fe80::48bd:ebf3:eee0:b08, (Cache flush) A 192.168.17.101 (205)
2024-02-29T10:41:58 10:41:58.593868 IP6 fe80::48bd:ebf3:eee0:b08.mdns > ff02::fb.mdns: 0*- [0q] 3/0/0 (Cache flush) TXT "", (Cache flush) SRV nqm-perfect-pi.local.:8082 0 0, (Cache flush) AAAA fe80::48bd:ebf3:eee0:b08 (138)
2024-02-29T10:41:59 10:41:58.632300 IP 192.168.17.101.mdns > mdns.mcast.net.mdns: 0*- [0q] 5/0/0 (Cache flush) PTR nqm-perfect-pi.local., (Cache flush) SRV nqm-perfect-pi.local.:8082 0 0, (Cache flush) A 192.168.17.101, (Cache flush) TXT "", (Cache flush) AAAA fe80::48bd:ebf3:eee0:b08 (240)
2024-02-29T10:41:59 10:41:58.632518 IP6 fe80::48bd:ebf3:eee0:b08.mdns > ff02::fb.mdns: 0*- [0q] 1/0/0 (Cache flush) PTR nqm-perfect-pi.local. (118)
2024-02-29T10:41:59 10:41:58.632643 IP 192.168.17.101.mdns > mdns.mcast.net.mdns: 0*- [0q] 1/0/0 (Cache flush) PTR nqm-perfect-pi.local. (73)
2024-02-29T10:41:59 10:41:58.764912 ARP, Request who-has 192.168.17.101 tell 192.168.17.101, length 28
2024-02-29T10:42:00 10:41:59.958188 IP6 fe80::48bd:ebf3:eee0:b08 > ip6-allrouters: ICMP6, router solicitation, length 8
2024-02-29T10:42:00 10:41:59.978955 ARP, Request who-has 192.168.17.101 tell 192.168.17.1, length 28
2024-02-29T10:42:00 10:41:59.981799 ARP, Reply 192.168.17.101 is-at d8:3a:dd:36:66:78 (oui Unknown), length 28
2024-02-29T10:42:00 10:41:59.994597 ARP, Request who-has 192.168.17.1 tell 192.168.17.101, length 28
2024-02-29T10:42:00 10:41:59.994621 ARP, Reply 192.168.17.1 is-at d8:3a:dd:7d:e0:b5 (oui Unknown), length 28
2024-02-29T10:42:00 10:41:59.996408 IP 192.168.17.101.45162 > 192.168.17.1.12345: Flags [S], seq 3294466383, win 64240, options [mss 1460,sackOK,TS val 1291623607 ecr 0,nop,wscale 7], length 0
2024-02-29T10:42:00 10:41:59.996477 IP 192.168.17.1.12345 > 192.168.17.101.45162: Flags [S.], seq 3436103818, ack 3294466384, win 65160, options [mss 1460,sackOK,TS val 2827676385 ecr 1291623607,nop,wscale 7], length 0
2024-02-29T10:42:00 10:41:59.997934 IP 192.168.17.101.45162 > 192.168.17.1.12345: Flags [.], ack 1, win 502, options [nop,nop,TS val 1291623610 ecr 2827676385], length 0
2024-02-29T10:42:00 10:42:00.015702 IP 192.168.17.101.45162 > 192.168.17.1.12345: Flags [P.], seq 1:226, ack 1, win 502, options [nop,nop,TS val 1291623620 ecr 2827676385], length 225
2024-02-29T10:42:00 10:42:00.015802 IP 192.168.17.1.12345 > 192.168.17.101.45162: Flags [.], ack 226, win 508, options [nop,nop,TS val 2827676404 ecr 1291623620], length 0
2024-02-29T10:42:00 10:42:00.019482 IP 192.168.17.1.12345 > 192.168.17.101.45162: Flags [P.], seq 1:777, ack 226, win 508, options [nop,nop,TS val 2827676408 ecr 1291623620], length 776
2024-02-29T10:42:00 10:42:00.024260 IP 192.168.17.101.45162 > 192.168.17.1.12345: Flags [.], ack 777, win 501, options [nop,nop,TS val 1291623635 ecr 2827676408], length 0
2024-02-29T10:42:00 10:42:00.025914 IP 192.168.17.101.45162 > 192.168.17.1.12345: Flags [P.], seq 226:336, ack 777, win 501, options [nop,nop,TS val 1291623638 ecr 2827676408], length 110
2024-02-29T10:42:00 10:42:00.026093 IP 192.168.17.1.12345 > 192.168.17.101.45162: Flags [P.], seq 777:801, ack 336, win 508, options [nop,nop,TS val 2827676415 ecr 1291623638], length 24
2024-02-29T10:42:00 10:42:00.026255 IP 192.168.17.1.12345 > 192.168.17.101.45162: Flags [F.], seq 801, ack 336, win 508, options [nop,nop,TS val 2827676415 ecr 1291623638], length 0
2024-02-29T10:42:00 10:42:00.026298 IP 192.168.17.1.12345 > 192.168.17.101.45162: Flags [R.], seq 802, ack 336, win 508, options [nop,nop,TS val 2827676415 ecr 1291623638], length 0
2024-02-29T10:42:00 10:42:00.027714 IP 192.168.17.101.45162 > 192.168.17.1.12345: Flags [F.], seq 336, ack 802, win 501, options [nop,nop,TS val 1291623640 ecr 2827676415], length 0
2024-02-29T10:42:00 10:42:00.027772 IP 192.168.17.1.12345 > 192.168.17.101.45162: Flags [R], seq 3436104620, win 0, length 0
2024-02-29T10:42:01 10:42:00.782022 IP 192.168.17.101.45172 > 192.168.17.1.12345: Flags [S], seq 3419803393, win 64240, options [mss 1460,sackOK,TS val 1291624392 ecr 0,nop,wscale 7], length 0
2024-02-29T10:42:01 10:42:00.782109 IP 192.168.17.1.12345 > 192.168.17.101.45172: Flags [S.], seq 1689370135, ack 3419803394, win 65160, options [mss 1460,sackOK,TS val 2827677171 ecr 1291624392,nop,wscale 7], length 0
2024-02-29T10:42:01 10:42:00.783513 IP 192.168.17.101.45172 > 192.168.17.1.12345: Flags [.], ack 1, win 502, options [nop,nop,TS val 1291624396 ecr 2827677171], length 0
2024-02-29T10:42:01 10:42:00.803827 IP 192.168.17.101.45172 > 192.168.17.1.12345: Flags [P.], seq 1:220, ack 1, win 502, options [nop,nop,TS val 1291624416 ecr 2827677171], length 219
2024-02-29T10:42:01 10:42:00.803900 IP 192.168.17.1.12345 > 192.168.17.101.45172: Flags [.], ack 220, win 508, options [nop,nop,TS val 2827677192 ecr 1291624416], length 0
2024-02-29T10:42:01 10:42:00.806083 IP 192.168.17.1.12345 > 192.168.17.101.45172: Flags [P.], seq 1:776, ack 220, win 508, options [nop,nop,TS val 2827677195 ecr 1291624416], length 775
2024-02-29T10:42:01 10:42:00.807552 IP 192.168.17.101.45172 > 192.168.17.1.12345: Flags [.], ack 776, win 501, options [nop,nop,TS val 1291624420 ecr 2827677195], length 0
2024-02-29T10:42:02 10:42:01.813487 IP6 fe80::48bd:ebf3:eee0:b08.mdns > ff02::fb.mdns: 0 [9q] PTR (QM)? _nfs._tcp.local. PTR (QM)? _ipp._tcp.local. PTR (QM)? _ipps._tcp.local. PTR (QM)? _ftp._tcp.local. PTR (QM)? _webdav._tcp.local. PTR (QM)? _webdavs._tcp.local. PTR (QM)? _sftp-ssh._tcp.local. PTR (QM)? _smb._tcp.local. PTR (QM)? _afpovertcp._tcp.local. (141)
2024-02-29T10:42:02 10:42:01.859687 IP 192.168.17.101.mdns > mdns.mcast.net.mdns: 0 [9q] PTR (QM)? _nfs._tcp.local. PTR (QM)? _ipp._tcp.local. PTR (QM)? _ipps._tcp.local. PTR (QM)? _ftp._tcp.local. PTR (QM)? _webdav._tcp.local. PTR (QM)? _webdavs._tcp.local. PTR (QM)? _sftp-ssh._tcp.local. PTR (QM)? _smb._tcp.local. PTR (QM)? _afpovertcp._tcp.local. (141)
2024-02-29T10:42:02 10:42:02.435357 IP 192.168.17.101.45172 > 192.168.17.1.12345: Flags [P.], seq 220:807, ack 776, win 501, options [nop,nop,TS val 1291626044 ecr 2827677195], length 587
2024-02-29T10:42:02 10:42:02.441947 IP 192.168.17.1.12345 > 192.168.17.101.45172: Flags [P.], seq 776:1399, ack 807, win 504, options [nop,nop,TS val 2827678830 ecr 1291626044], length 623
2024-02-29T10:42:02 10:42:02.444994 IP 192.168.17.101.45172 > 192.168.17.1.12345: Flags [.], seq 807:2255, ack 776, win 501, options [nop,nop,TS val 1291626045 ecr 2827677195], length 1448
2024-02-29T10:42:02 10:42:02.445063 IP 192.168.17.101.45172 > 192.168.17.1.12345: Flags [P.], seq 2255:2947, ack 776, win 501, options [nop,nop,TS val 1291626045 ecr 2827677195], length 692
2024-02-29T10:42:02 10:42:02.445081 IP 192.168.17.101.45172 > 192.168.17.1.12345: Flags [FP.], seq 2947:2971, ack 776, win 501, options [nop,nop,TS val 1291626045 ecr 2827677195], length 24
2024-02-29T10:42:02 10:42:02.445167 IP 192.168.17.1.12345 > 192.168.17.101.45172: Flags [.], ack 2972, win 494, options [nop,nop,TS val 2827678834 ecr 1291626045], length 0
2024-02-29T10:42:02 10:42:02.445216 IP 192.168.17.101.45172 > 192.168.17.1.12345: Flags [.], ack 1399, win 501, options [nop,nop,TS val 1291626056 ecr 2827678830], length 0
2024-02-29T10:42:02 10:42:02.445262 IP 192.168.17.1.12345 > 192.168.17.101.45172: Flags [P.], seq 1399:2022, ack 2972, win 501, options [nop,nop,TS val 2827678834 ecr 1291626056], length 623
2024-02-29T10:42:02 10:42:02.446976 IP 192.168.17.101.45172 > 192.168.17.1.12345: Flags [.], ack 2022, win 501, options [nop,nop,TS val 1291626059 ecr 2827678834], length 0
2024-02-29T10:42:02 10:42:02.447526 IP 192.168.17.1.12345 > 192.168.17.101.45172: Flags [P.], seq 2022:2192, ack 2972, win 501, options [nop,nop,TS val 2827678836 ecr 1291626059], length 170
2024-02-29T10:42:02 10:42:02.448060 IP 192.168.17.1.12345 > 192.168.17.101.45172: Flags [FP.], seq 2192:2386, ack 2972, win 501, options [nop,nop,TS val 2827678837 ecr 1291626059], length 194
2024-02-29T10:42:02 10:42:02.449371 IP 192.168.17.101.45172 > 192.168.17.1.12345: Flags [.], ack 2192, win 501, options [nop,nop,TS val 1291626061 ecr 2827678836], length 0
2024-02-29T10:42:02 10:42:02.449577 IP 192.168.17.101.45172 > 192.168.17.1.12345: Flags [.], ack 2387, win 501, options [nop,nop,TS val 1291626062 ecr 2827678837], length 0
2024-02-29T10:42:07 10:42:07.717005 IP6 fe80::48bd:ebf3:eee0:b08 > ip6-allrouters: ICMP6, router solicitation, length 8
2024-02-29T10:42:09 10:42:09.852462 IP6 fe80::48bd:ebf3:eee0:b08.mdns > ff02::fb.mdns: 0 [9q] PTR (QM)? _nfs._tcp.local. PTR (QM)? _ipp._tcp.local. PTR (QM)? _ipps._tcp.local. PTR (QM)? _ftp._tcp.local. PTR (QM)? _webdav._tcp.local. PTR (QM)? _webdavs._tcp.local. PTR (QM)? _sftp-ssh._tcp.local. PTR (QM)? _smb._tcp.local. PTR (QM)? _afpovertcp._tcp.local. (141)
2024-02-29T10:42:09 10:42:09.856592 IP 192.168.17.101.mdns > mdns.mcast.net.mdns: 0 [9q] PTR (QM)? _nfs._tcp.local. PTR (QM)? _ipp._tcp.local. PTR (QM)? _ipps._tcp.local. PTR (QM)? _ftp._tcp.local. PTR (QM)? _webdav._tcp.local. PTR (QM)? _webdavs._tcp.local. PTR (QM)? _sftp-ssh._tcp.local. PTR (QM)? _smb._tcp.local. PTR (QM)? _afpovertcp._tcp.local. (141)
2024-02-29T10:42:23 10:42:23.089983 IP6 fe80::48bd:ebf3:eee0:b08 > ip6-allrouters: ICMP6, router solicitation, length 8
2024-02-29T10:42:26 10:42:25.821300 IP6 fe80::48bd:ebf3:eee0:b08.mdns > ff02::fb.mdns: 0 [9q] PTR (QM)? _nfs._tcp.local. PTR (QM)? _ipp._tcp.local. PTR (QM)? _ipps._tcp.local. PTR (QM)? _ftp._tcp.local. PTR (QM)? _webdav._tcp.local. PTR (QM)? _webdavs._tcp.local. PTR (QM)? _sftp-ssh._tcp.local. PTR (QM)? _smb._tcp.local. PTR (QM)? _afpovertcp._tcp.local. (141)
2024-02-29T10:42:26 10:42:25.857180 IP 192.168.17.101.mdns > mdns.mcast.net.mdns: 0 [9q] PTR (QM)? _nfs._tcp.local. PTR (QM)? _ipp._tcp.local. PTR (QM)? _ipps._tcp.local. PTR (QM)? _ftp._tcp.local. PTR (QM)? _webdav._tcp.local. PTR (QM)? _webdavs._tcp.local. PTR (QM)? _sftp-ssh._tcp.local. PTR (QM)? _smb._tcp.local. PTR (QM)? _afpovertcp._tcp.local. (141)
2024-02-29T10:42:52 10:42:52.675619 IP6 fe80::48bd:ebf3:eee0:b08 > ip6-allrouters: ICMP6, router solicitation, length 8
2024-02-29T10:42:58 10:42:57.820546 IP6 fe80::48bd:ebf3:eee0:b08.mdns > ff02::fb.mdns: 0 [9q] PTR (QM)? _nfs._tcp.local. PTR (QM)? _ipp._tcp.local. PTR (QM)? _ipps._tcp.local. PTR (QM)? _ftp._tcp.local. PTR (QM)? _webdav._tcp.local. PTR (QM)? _webdavs._tcp.local. PTR (QM)? _sftp-ssh._tcp.local. PTR (QM)? _smb._tcp.local. PTR (QM)? _afpovertcp._tcp.local. (141)
2024-02-29T10:42:58 10:42:57.857806 IP 192.168.17.101.mdns > mdns.mcast.net.mdns: 0 [9q] PTR (QM)? _nfs._tcp.local. PTR (QM)? _ipp._tcp.local. PTR (QM)? _ipps._tcp.local. PTR (QM)? _ftp._tcp.local. PTR (QM)? _webdav._tcp.local. PTR (QM)? _webdavs._tcp.local. PTR (QM)? _sftp-ssh._tcp.local. PTR (QM)? _smb._tcp.local. PTR (QM)? _afpovertcp._tcp.local. (141)
2024-02-29T10:43:49 10:43:49.158826 IP6 fe80::48bd:ebf3:eee0:b08 > ip6-allrouters: ICMP6, router solicitation, length 8
2024-02-29T10:44:02 10:44:01.823747 IP6 fe80::48bd:ebf3:eee0:b08.mdns > ff02::fb.mdns: 0 [9q] PTR (QM)? _nfs._tcp.local. PTR (QM)? _ipp._tcp.local. PTR (QM)? _ipps._tcp.local. PTR (QM)? _ftp._tcp.local. PTR (QM)? _webdav._tcp.local. PTR (QM)? _webdavs._tcp.local. PTR (QM)? _sftp-ssh._tcp.local. PTR (QM)? _smb._tcp.local. PTR (QM)? _afpovertcp._tcp.local. (141)
2024-02-29T10:44:02 10:44:01.857355 IP 192.168.17.101.mdns > mdns.mcast.net.mdns: 0 [9q] PTR (QM)? _nfs._tcp.local. PTR (QM)? _ipp._tcp.local. PTR (QM)? _ipps._tcp.local. PTR (QM)? _ftp._tcp.local. PTR (QM)? _webdav._tcp.local. PTR (QM)? _webdavs._tcp.local. PTR (QM)? _sftp-ssh._tcp.local. PTR (QM)? _smb._tcp.local. PTR (QM)? _afpovertcp._tcp.local. (141)
2024-02-29T10:45:45 10:45:44.930623 IP6 fe80::48bd:ebf3:eee0:b08 > ip6-allrouters: ICMP6, router solicitation, length 8
2024-02-29T10:46:10 10:46:09.821581 IP6 fe80::48bd:ebf3:eee0:b08.mdns > ff02::fb.mdns: 0 [9q] PTR (QM)? _nfs._tcp.local. PTR (QM)? _ipp._tcp.local. PTR (QM)? _ipps._tcp.local. PTR (QM)? _ftp._tcp.local. PTR (QM)? _webdav._tcp.local. PTR (QM)? _webdavs._tcp.local. PTR (QM)? _sftp-ssh._tcp.local. PTR (QM)? _smb._tcp.local. PTR (QM)? _afpovertcp._tcp.local. (141)
2024-02-29T10:46:10 10:46:09.858831 IP 192.168.17.101.mdns > mdns.mcast.net.mdns: 0 [9q] PTR (QM)? _nfs._tcp.local. PTR (QM)? _ipp._tcp.local. PTR (QM)? _ipps._tcp.local. PTR (QM)? _ftp._tcp.local. PTR (QM)? _webdav._tcp.local. PTR (QM)? _webdavs._tcp.local. PTR (QM)? _sftp-ssh._tcp.local. PTR (QM)? _smb._tcp.local. PTR (QM)? _afpovertcp._tcp.local. (141)
2024-02-29T10:49:48 10:49:47.666248 IP6 fe80::48bd:ebf3:eee0:b08 > ip6-allrouters: ICMP6, router solicitation, length 8
2024-02-29T10:50:26 10:50:25.822235 IP6 fe80::48bd:ebf3:eee0:b08.mdns > ff02::fb.mdns: 0 [9q] PTR (QM)? _nfs._tcp.local. PTR (QM)? _ipp._tcp.local. PTR (QM)? _ipps._tcp.local. PTR (QM)? _ftp._tcp.local. PTR (QM)? _webdav._tcp.local. PTR (QM)? _webdavs._tcp.local. PTR (QM)? _sftp-ssh._tcp.local. PTR (QM)? _smb._tcp.local. PTR (QM)? _afpovertcp._tcp.local. (141)
2024-02-29T10:50:26 10:50:25.859412 IP 192.168.17.101.mdns > mdns.mcast.net.mdns: 0 [9q] PTR (QM)? _nfs._tcp.local. PTR (QM)? _ipp._tcp.local. PTR (QM)? _ipps._tcp.local. PTR (QM)? _ftp._tcp.local. PTR (QM)? _webdav._tcp.local. PTR (QM)? _webdavs._tcp.local. PTR (QM)? _sftp-ssh._tcp.local. PTR (QM)? _smb._tcp.local. PTR (QM)? _afpovertcp._tcp.local. (141)
2024-02-29T10:53:04 10:53:03.363231 IP 192.168.17.1.mdns > mdns.mcast.net.mdns: 0 [2q] PTR (QM)? _ipps._tcp.local. PTR (QM)? _ipp._tcp.local. (45)
2024-02-29T10:57:31 10:57:30.557249 IP6 fe80::48bd:ebf3:eee0:b08 > ip6-allrouters: ICMP6, router solicitation, length 8
2024-02-29T10:58:58 10:58:57.827513 IP6 fe80::48bd:ebf3:eee0:b08.mdns > ff02::fb.mdns: 0 [9q] PTR (QM)? _nfs._tcp.local. PTR (QM)? _ipp._tcp.local. PTR (QM)? _ipps._tcp.local. PTR (QM)? _ftp._tcp.local. PTR (QM)? _webdav._tcp.local. PTR (QM)? _webdavs._tcp.local. PTR (QM)? _sftp-ssh._tcp.local. PTR (QM)? _smb._tcp.local. PTR (QM)? _afpovertcp._tcp.local. (141)
2024-02-29T10:58:58 10:58:57.856593 IP 192.168.17.101.mdns > mdns.mcast.net.mdns: 0 [9q] PTR (QM)? _nfs._tcp.local. PTR (QM)? _ipp._tcp.local. PTR (QM)? _ipps._tcp.local. PTR (QM)? _ftp._tcp.local. PTR (QM)? _webdav._tcp.local. PTR (QM)? _webdavs._tcp.local. PTR (QM)? _sftp-ssh._tcp.local. PTR (QM)? _smb._tcp.local. PTR (QM)? _afpovertcp._tcp.local. (141)
2024-02-29T10:59:52 10:59:52.372276 IP 0.0.0.0.bootpc > 255.255.255.255.bootps: BOOTP/DHCP, Request from d8:3a:dd:36:66:78 (oui Unknown), length 298
