tcpdump: verbose output suppressed, use -v[v]... for full protocol decode
listening on wlan1, link-type EN10MB (Ethernet), snapshot length 262144 bytes
2024-03-07T11:33:16 11:33:16.099879 IP 192.168.16.121 > 192.168.0.0: ICMP echo request, id 5, seq 1, length 64
2024-03-07T11:33:17 11:33:17.127244 IP 192.168.16.121 > 192.168.0.0: ICMP echo request, id 5, seq 2, length 64
2024-03-07T11:33:18 11:33:18.151292 IP 192.168.16.121 > 192.168.0.0: ICMP echo request, id 5, seq 3, length 64
2024-03-07T11:33:19 11:33:19.172219 IP 192.168.16.121 > 192.168.0.0: ICMP echo request, id 5, seq 4, length 64
2024-03-07T11:33:20 11:33:20.200035 IP 192.168.16.121 > 192.168.0.0: ICMP echo request, id 5, seq 5, length 64
2024-03-07T11:33:21 11:33:21.223284 IP 192.168.16.121 > 192.168.0.0: ICMP echo request, id 5, seq 6, length 64
2024-03-07T11:33:21 11:33:21.319058 ARP, Request who-has 192.168.16.1 tell 192.168.16.121, length 28
2024-03-07T11:33:21 11:33:21.319106 ARP, Reply 192.168.16.1 is-at 00:0f:00:de:12:8f (oui Unknown), length 28
2024-03-07T11:33:22 11:33:22.247269 IP 192.168.16.121 > 192.168.0.0: ICMP echo request, id 5, seq 7, length 64
2024-03-07T11:33:23 11:33:23.273692 IP 192.168.16.121 > 192.168.0.0: ICMP echo request, id 5, seq 8, length 64
2024-03-07T11:33:26 11:33:26.327549 IP 192.168.16.121 > 192.168.0.77: ICMP echo request, id 6, seq 1, length 64
2024-03-07T11:33:27 11:33:27.335281 IP 192.168.16.121 > 192.168.0.77: ICMP echo request, id 6, seq 2, length 64
2024-03-07T11:33:28 11:33:28.359292 IP 192.168.16.121 > 192.168.0.77: ICMP echo request, id 6, seq 3, length 64
2024-03-07T11:33:29 11:33:29.386312 IP 192.168.16.121 > 192.168.0.77: ICMP echo request, id 6, seq 4, length 64
2024-03-07T11:33:30 11:33:30.407277 IP 192.168.16.121 > 192.168.0.77: ICMP echo request, id 6, seq 5, length 64
2024-03-07T11:33:31 11:33:31.431265 IP 192.168.16.121 > 192.168.0.77: ICMP echo request, id 6, seq 6, length 64
2024-03-07T11:33:32 11:33:32.455282 IP 192.168.16.121 > 192.168.0.77: ICMP echo request, id 6, seq 7, length 64
2024-03-07T11:33:33 11:33:33.479267 IP 192.168.16.121 > 192.168.0.77: ICMP echo request, id 6, seq 8, length 64
2024-03-07T11:33:34 11:33:34.503257 IP 192.168.16.121 > 192.168.0.77: ICMP echo request, id 6, seq 9, length 64
2024-03-07T11:33:35 11:33:35.527259 IP 192.168.16.121 > 192.168.0.77: ICMP echo request, id 6, seq 10, length 64
2024-03-07T11:33:36 11:33:36.563095 IP 192.168.16.121 > 192.168.0.77: ICMP echo request, id 6, seq 11, length 64
2024-03-07T11:33:37 11:33:37.576238 IP 192.168.16.121 > 192.168.0.77: ICMP echo request, id 6, seq 12, length 64
2024-03-07T11:33:38 11:33:38.599300 IP 192.168.16.121 > 192.168.0.77: ICMP echo request, id 6, seq 13, length 64
2024-03-07T11:33:39 11:33:39.633893 IP 192.168.16.121 > 192.168.0.77: ICMP echo request, id 6, seq 14, length 64
2024-03-07T11:33:53 11:33:53.593917 IP 192.168.16.121 > 203.0.113.0: ICMP echo request, id 7, seq 1, length 64
2024-03-07T11:33:54 11:33:54.623729 IP 192.168.16.121 > 203.0.113.0: ICMP echo request, id 7, seq 2, length 64
2024-03-07T11:33:55 11:33:55.623347 IP 192.168.16.121 > 203.0.113.0: ICMP echo request, id 7, seq 3, length 64
2024-03-07T11:33:56 11:33:56.647203 IP 192.168.16.121 > 203.0.113.0: ICMP echo request, id 7, seq 4, length 64
2024-03-07T11:33:57 11:33:57.672163 IP 192.168.16.121 > 203.0.113.0: ICMP echo request, id 7, seq 5, length 64
2024-03-07T11:33:58 11:33:58.695772 IP 192.168.16.121 > 203.0.113.0: ICMP echo request, id 7, seq 6, length 64
2024-03-07T11:33:59 11:33:59.719204 IP 192.168.16.121 > 203.0.113.0: ICMP echo request, id 7, seq 7, length 64
2024-03-07T11:34:00 11:34:00.743200 IP 192.168.16.121 > 203.0.113.0: ICMP echo request, id 7, seq 8, length 64
2024-03-07T11:34:01 11:34:01.767192 IP 192.168.16.121 > 203.0.113.0: ICMP echo request, id 7, seq 9, length 64
2024-03-07T11:34:02 11:34:02.791229 IP 192.168.16.121 > 203.0.113.0: ICMP echo request, id 7, seq 10, length 64
2024-03-07T11:34:03 11:34:03.815179 IP 192.168.16.121 > 203.0.113.0: ICMP echo request, id 7, seq 11, length 64
2024-03-07T11:34:07 11:34:07.911030 ARP, Request who-has 192.168.16.1 tell 192.168.16.121, length 28
2024-03-07T11:34:08 11:34:07.911086 ARP, Reply 192.168.16.1 is-at 00:0f:00:de:12:8f (oui Unknown), length 28
2024-03-07T11:35:06 11:35:06.767020 IP 192.168.16.121 > 203.0.113.99: ICMP echo request, id 8, seq 1, length 64
2024-03-07T11:35:07 11:35:07.783107 IP 192.168.16.121 > 203.0.113.99: ICMP echo request, id 8, seq 2, length 64
2024-03-07T11:35:08 11:35:08.807098 IP 192.168.16.121 > 203.0.113.99: ICMP echo request, id 8, seq 3, length 64
2024-03-07T11:35:09 11:35:09.831117 IP 192.168.16.121 > 203.0.113.99: ICMP echo request, id 8, seq 4, length 64
2024-03-07T11:35:10 11:35:10.855098 IP 192.168.16.121 > 203.0.113.99: ICMP echo request, id 8, seq 5, length 64
2024-03-07T11:35:11 11:35:11.879099 IP 192.168.16.121 > 203.0.113.99: ICMP echo request, id 8, seq 6, length 64
2024-03-07T11:35:11 11:35:11.907853 ARP, Request who-has 192.168.16.1 tell 192.168.16.121, length 28
2024-03-07T11:35:11 11:35:11.907884 ARP, Reply 192.168.16.1 is-at 00:0f:00:de:12:8f (oui Unknown), length 28
2024-03-07T11:35:13 11:35:12.903111 IP 192.168.16.121 > 203.0.113.99: ICMP echo request, id 8, seq 7, length 64
2024-03-07T11:35:13 11:35:13.929384 IP 192.168.16.121 > 203.0.113.99: ICMP echo request, id 8, seq 8, length 64
2024-03-07T11:35:14 11:35:14.951143 IP 192.168.16.121 > 203.0.113.99: ICMP echo request, id 8, seq 9, length 64
2024-03-07T11:35:16 11:35:15.976175 IP 192.168.16.121 > 203.0.113.99: ICMP echo request, id 8, seq 10, length 64
2024-03-07T11:35:17 11:35:16.999156 IP 192.168.16.121 > 203.0.113.99: ICMP echo request, id 8, seq 11, length 64
2024-03-07T11:35:18 11:35:18.023139 IP 192.168.16.121 > 203.0.113.99: ICMP echo request, id 8, seq 12, length 64
2024-03-07T11:35:19 11:35:19.047121 IP 192.168.16.121 > 203.0.113.99: ICMP echo request, id 8, seq 13, length 64
2024-03-07T11:35:20 11:35:20.071144 IP 192.168.16.121 > 203.0.113.99: ICMP echo request, id 8, seq 14, length 64
2024-03-07T11:35:21 11:35:21.095151 IP 192.168.16.121 > 203.0.113.99: ICMP echo request, id 8, seq 15, length 64